0;1
0;"{'criterio_de_pesquisa': 'uninove', 'frase_original': TextBlob(""@dcaf1 @uninove primeiro bimestre fiz de noite e acabei não gostando muito,então agora no segundo mudei para manhã""), 'frase_traduzida': TextBlob(""@dcaf1 @uninove primeiro bimestre fiz de noite e acabei não gostando muito,então agora no segundo mudei para manhã""), 'polaridade': 0.0, 'subjetividade': 0.0}"
1;"{'criterio_de_pesquisa': 'uninove', 'frase_original': TextBlob(""@gabyagy @uninove aeeeee

a uninove fez isso na minha primeira kkk eu entrei na sala do pessoal do segundo 

você faz de manhã ou de noite ?""), 'frase_traduzida': TextBlob(""@gabyagy @uninove aeeeee

a uninove fez isso na minha primeira kkk eu entrei na sala do pessoal do segundo 

você faz de manhã ou de noite ?""), 'polaridade': 0.0, 'subjetividade': 0.0}"
2;"{'criterio_de_pesquisa': 'uninove', 'frase_original': TextBlob(""sabadão, dia de tomar banho*

nesse frio intenso alguém tem alguma dica de como tomar banho sem se molhar?""), 'frase_traduzida': TextBlob(""sabadão, dia de tomar banho*

nesse frio intenso alguém tem alguma dica de como tomar banho sem se molhar?""), 'polaridade': 0.0, 'subjetividade': 0.0}"
3;"{'criterio_de_pesquisa': 'uninove', 'frase_original': TextBlob(""a uninove demora um século pra liberar os boletos, ai quando libera vence no outro dia 🤪""), 'frase_traduzida': TextBlob(""a uninove demora um século pra liberar os boletos, ai quando libera vence no outro dia 🤪""), 'polaridade': 0.0, 'subjetividade': 0.0}"
4;"{'criterio_de_pesquisa': 'uninove', 'frase_original': TextBlob(""reclama da fmu quem não conhece a uninove""), 'frase_traduzida': TextBlob(""reclama da fmu quem não conhece a uninove""), 'polaridade': 0.0, 'subjetividade': 0.0}"
